### ISSUE TITLE
documentation related for multicast

### ISSUE THREAD

**Issue by spyroot** [homebridge/homebridge#2776]
**Describe Your Problem:**

Hi Folks I run home-bridge in the VM environment,  home-bridge communicated outside.
and the same server used DNS in the entire home.    So from a connectivity point of view, all devices can communicate to a server.  The server has a single adapter.

The main problem I can't add from homekit device. It trying to connect and then respond to an accessory not found.
I run TCP dump and I don't see any traffic coming from homekit device.     I filter by source IP that the iPhone received 
from DHCP.

I noticed that there is multicast traffic going from homebridge.  What is the requirement related to multicast?
For example, if you have a router in between homekit and homebridge will that work?

iPhone ----- network X --- router --- network Y -- homebrdige.

Thank you.

[**Logs:**]()

```
● homebridge.service - Homebridge
     Loaded: loaded (/etc/systemd/system/homebridge.service; enabled; vendor preset: enabled)
     Active: active (running) since Sun 2021-01-17 21:56:48 +04; 11h ago
    Process: 72379 ExecStartPre=/usr/bin/run-parts /etc/hb-service/homebridge/prestart.d (code=exited, status=0/SUCCESS)
    Process: 72382 ExecStartPre=/usr/local/lib/node_modules/homebridge-config-ui-x/dist/bin/hb-service.js before-start $HOMEBRIDGE_OPTS (code=exited, status=0/SUCCESS)
   Main PID: 72389 (node)
      Tasks: 22 (limit: 4610)
     Memory: 159.9M
     CGroup: /system.slice/homebridge.service
             ├─72389 hb-service
             └─77897 homebridge

Jan 17 21:56:47 lazyvector systemd[1]: Starting Homebridge...
Jan 17 21:56:47 lazyvector run-parts[72380]: Ensuring /var/lib/homebridge is owned by homebridge
Jan 17 21:56:48 lazyvector systemd[1]: Started Homebridge.
Jan 17 21:56:48 lazyvector hb-service.js[72389]: [1/17/2021, 9:56:48 PM] [HB Supervisor] Homebridge Storage Path: /var/lib/homebridge
Jan 17 21:56:48 lazyvector hb-service.js[72389]: [1/17/2021, 9:56:48 PM] [HB Supervisor] Homebridge Config Path: /var/lib/homebridge/config.json
Jan 17 21:56:48 lazyvector hb-service.js[72389]: [1/17/2021, 9:56:48 PM] [HB Supervisor] Logging to /var/lib/homebridge/homebridge.log

```

Zero error.

```
root@lazyvector:~# netstat -an|grep 51410
tcp        0      0 192.168.66.1:60326      192.168.66.1:51410      ESTABLISHED
tcp6       0      0 :::51410                :::*                    LISTEN -- >> all good
tcp6       0      0 127.0.0.1:51410         127.0.0.1:37940         TIME_WAIT
tcp6       0      0 127.0.0.1:51410         127.0.0.1:37920         TIME_WAIT
tcp6       0      0 127.0.0.1:51410         127.0.0.1:37936         TIME_WAIT
tcp6       0      0 127.0.0.1:51410         127.0.0.1:37928         TIME_WAIT
tcp6       0      0 127.0.0.1:51410         127.0.0.1:37932         TIME_WAIT
tcp6       0      0 192.168.66.1:51410      192.168.66.1:60326      ESTABLISHED
tcp6       0      0 127.0.0.1:51410         127.0.0.1:37924         TIME_WAIT
``
-> nothing 
```
root@lazyvector:~# tcpdump -i enp0s4 tcp port 51410
tcpdump: verbose output suppressed, use -v or -vv for full protocol decode
listening on enp0s4, link-type EN10MB (Ethernet), capture size 262144 bytes
```

```
tcpdump -i enp0s4 src 192.168.254.77 --> source IP
tcpdump: verbose output suppressed, use -v or -vv for full protocol decode
listening on enp0s4, link-type EN10MB (Ethernet), capture size 262144 bytes
```

```
mCAst I see packet going out
tcpdump: verbose output suppressed, use -v or -vv for full protocol decode
listening on enp0s4, link-type EN10MB (Ethernet), capture size 262144 bytes
09:49:07.848875 IP 192.168.66.1.5353 > 224.0.0.251.5353: 0*- [0q] 4/0/0 PTR Homebridge 257D._hap._tcp.local., (Cache flush) SRV 00_A0_98_23_3F_F6.local.:51410 0 0, (Cache flush) TXT "md=Homebridge" "pv=1.1" "id=00:A0:98:23:3F:F6" "c#=10" "s#=1" "ff=0" "ci=2" "sf=1" "sh=/W4mgw==", (Cache flush) A 192.168.66.1 (308)
09:49:10.851374 IP 192.168.66.1.5353 > 224.0.0.251.5353: 0*- [0q] 4/0/0 PTR Homebridge 257D._hap._tcp.local., (Cache flush) SRV 00_A0_98_23_3F_F6.local.:51410 0 0, (Cache flush) TXT "md=Homebridge" "pv=1.1" "id=00:A0:98:23:3F:F6" "c#=10" "s#=1" "ff=0" "ci=2" "sf=1" "sh=/W4mgw==", (Cache flush) A 192.168.66.1 (308)
09:49:13.855377 IP 192.168.66.1.5353 > 224.0.0.251.5353: 0*- [0q] 4/0/0 PTR Homebridge 257D._hap._tcp.local., (Cache flush) SRV 00_A0_98_23_3F_F6.local.:51410 0 0, (Cache flush) TXT "md=Homebridge" "pv=1.1" "id=00:A0:98:23:3F:F6" "c#=10" "s#=1" "ff=0" "ci=2" "sf=1" "sh=/W4mgw==", (Cache flush) A 192.168.66.1 (308)
```
<!-- Please paste any relevant log output into a gist or using hastebin-->
<!-- If using hastebin or other text sharing website please make the lifespan long-->
<!-- Paste the link between the two () above -->
<!-- Remove any sensitive information, passwords, etc. -->
<!-- Please include the beginning of the log where the homebridge initialization happens -->
<!-- If needing to link multiple log files please do so between the ``` lines below -->

```
Secondary Homebridge Logs here
```

**Homebridge Config:**
<!-- Paste relevant output between the two ``` lines below -->
<!-- Remove any sensitive information, passwords, etc. -->

Show your homebridge config.json here

```
   "bridge": {
        "name": "Homebridge",
        "username": "**"
        "port": 51410,
        "pin": "**"
    },
    "accessories": [],
    "platforms": [
        {
            "name": "Config",
            "port": 8581,
            "platform": "config"
        },
        {
            "name": "Nest",
            "platform": "Nest"
        }
    ]

```
**Screenshots:**
<!-- If applicable, add screenshots to help explain your problem. -->

**Environment:**

* **Node.js Version**: <!-- node -v -->
* **NPM Version**: <!-- npm -v -->
* **Homebridge Version**: <!-- homebridge -V -->
* **Operating System**: Raspbian / Ubuntu / Debian / Windows / macOS / Docker / other

```
Ubuntu latest, all patches.

uname -a
Linux lazyvector 5.8.0-36-generic #40-Ubuntu SMP Tue Jan 5 21:54:35 UTC 2021 x86_64 x86_64 x86_64 GNU/Linux

root@lazyvector:~# node -v
v12.18.2
* **Process Supervisor**: Systemd / init.d / pm2 / launchctl / Docker / hb-service / other / none
```

<!-- Click the "Preview" tab before you submit to ensure the formatting is correct. -->

**Comment by ebaauw** [comment]
As you’ve captured, HoneKit discovers accessories using Bonjour, which uses multicast DNS.  This uses a local link multicast address, which by default isn’t forwarded to other subnets.  You need a reflector (I think they call it) on your router to forward these packets.  Similar to running UPnP across subnets.
